id,name,text,trans
3003024040010,めぐる,──それで、真乃と灯織と\nゲームに夢中になっちゃって,──然后，我和真乃还有灯织\n都沉迷于游戏了
0000000000000,プロデューサー,もしかして、CM出演したやつか？,难道是出演那个广告了吗？
3003024040020,めぐる,うん！,嗯！
3003024040030,めぐる,その後、ミニライブのこととか話してたんだけど\nわたし、寝落ちしちゃってて……えへへ,后来我们还聊了迷你演唱会的事情，\n可是我睡着了……嘿嘿
0000000000000,プロデューサー,はは、そうだったのか,哈哈，原来是这样啊
3003024040040,めぐる,ミニライブのコンセプト案がまとまったから、\n安心しちゃったのかも,迷你演唱会的概念方案已经定下来了，\n可能是因为安心了吧
0000000000000,プロデューサー,すごく悩ませちゃったみたいで、悪かったな,看来让你们很苦恼，真是不好意思
3003024040050,めぐる,ええ！？　なんで！？\nわたしはやれてよかったよー！,诶！？为什么！？\n我觉得能做到真的很开心！
3003024040060,めぐる,わたしたちのライブのことだもん\nプロデューサー全然悪くない！,这是我们的演唱会的事，\n制作人一点也不坏！
0000000000000,プロデューサー,そうか、ならよかった\nそれに、送ってもらったコンセプトすごくいいと思ったぞ,是吗，那就好\n而且你们发给我的概念我觉得非常棒
3003024040070,めぐる,ほんとっ？　やったー！,真的吗？太好了！
3003024040080,めぐる,実はね、CMのセリフがヒントになったんだ！,其实啊，广告的台词给了我灵感！
3003024040090,めぐる,『これが好きだったなー』って話から\n灯織がまとめてくれて,从“我喜欢这个啊”那种话题开始，\n灯织帮忙整理了
0000000000000,プロデューサー,なるほど……,原来如此……
3003024040100,めぐる,だから、あのお仕事をできて\nすっごくよかった！,所以能参与那个工作，\n我真的很开心！
0000000000000,プロデューサー,そういう刺激になる仕事を\nたくさん取ってこられるように俺も頑張るよ,我也会努力争取更多这样的刺激工作给你们的
3003024040110,めぐる,えへへ\nありがとう、プロデューサー！,嘿嘿\n谢谢你，制作人！
0000000000000,プロデューサー,ミニライブがますます楽しみだな,我越来越期待迷你演唱会了
3003024040120,めぐる,……来てくれた人たちとおんなじ気持ちになれる瞬間、\n作れたらいいなぁ,……如果能创造出和到场的人们\n同样感受的瞬间就好了
0000000000000,プロデューサー,もちろん、めぐるたちならできるさ！,当然了，巡你们一定能做到的！
3003024040130,めぐる,うん！,嗯！
0000000000000,プロデューサー,そのために、俺にできることがあったら\nなんでも言ってくれ,为了那个，如果我能帮忙的地方，\n随时告诉我
3003024040140,めぐる,……あ、じゃあ──,……啊，那──
3003024040150,めぐる,ミニライブの会場を実際に見に行きたいんだけど、\nいいかなぁ？,我想去实际看看迷你演唱会的会场，\n可以吗？
3003024040160,めぐる,真乃と灯織と一緒に！,和真乃、灯织一起去！
info,produce_events/300302404.json,,
译者,gpt-4.1-mini,,